{
  "schema_version": "1.0",
  "expander_id": "pcf8574",
  "display_name": "PCF8574 8-bit I2C GPIO Expander",
  "protocol": "i2c",
  "channels": 8,
  "channel_type": "digital_io",
  "i2c": {
    "default_addresses": [
      "0x20", "0x21", "0x22", "0x23", "0x24", "0x25", "0x26", "0x27",
      "0x38", "0x39", "0x3A", "0x3B", "0x3C", "0x3D", "0x3E", "0x3F"
    ],
    "address_pins": ["A0", "A1", "A2"],
    "max_speed_khz": 400
  },
  "limitations": {
    "no_pwm": true,
    "open_drain_only": true,
    "max_current_per_pin_ma": 20,
    "no_adc": true,
    "interrupt_pin_available": true
  },
  "use_cases": [
    "16 relays on ESP32-C3 (only 22 GPIO total)",
    "Button matrix without wasting GPIO",
    "LED status panels"
  ],
  "esphome": {
    "platform": "pcf8574",
    "min_version": "2022.1.0"
  },
  "last_verified": "2026-05-13",
  "verified_source": "NXP PCF8574 datasheet Rev. 5"
}
