{
  "schema_version": "1.0",
  "expander_id": "pca9685",
  "display_name": "PCA9685 16-channel 12-bit I2C PWM Controller",
  "protocol": "i2c",
  "channels": 16,
  "channel_type": "pwm",
  "i2c": {
    "default_addresses": [
      "0x40", "0x41", "0x42", "0x43", "0x44", "0x45", "0x46", "0x47",
      "0x48", "0x49", "0x4A", "0x4B", "0x4C", "0x4D", "0x4E", "0x4F",
      "0x50", "0x51", "0x52", "0x53", "0x54", "0x55", "0x56", "0x57",
      "0x58", "0x59", "0x5A", "0x5B", "0x5C", "0x5D", "0x5E", "0x5F",
      "0x60", "0x61", "0x62", "0x63", "0x64", "0x65", "0x66", "0x67",
      "0x68", "0x69", "0x6A", "0x6B", "0x6C", "0x6D", "0x6E", "0x6F",
      "0x70", "0x71", "0x72", "0x73", "0x74", "0x75", "0x76", "0x7F"
    ],
    "address_pins": ["A0", "A1", "A2", "A3", "A4", "A5"],
    "max_speed_khz": 1000
  },
  "limitations": {
    "no_pwm": false,
    "open_drain_only": false,
    "max_current_per_pin_ma": 25,
    "no_adc": true,
    "interrupt_pin_available": false
  },
  "use_cases": [
    "16 LEDs with smooth dimming",
    "16 servo motors",
    "RGB LED strip controllers without addressable LEDs"
  ],
  "esphome": {
    "platform": "pca9685",
    "min_version": "2022.1.0"
  },
  "last_verified": "2026-05-13",
  "verified_source": "NXP PCA9685 datasheet Rev. 5"
}
